{
  "$schema": "https://json-schema.org/draft/2020-12/schema",
  "$id": "https://identity-engineering.org/schemas/message-envelope-v0.1.json",
  "title": "MessageEnvelope",
  "type": "object",
  "required": ["messageId", "from", "to", "createdAt", "signal", "payload"],
  "properties": {
    "messageId": {
      "type": "string",
      "description": "UUID v7",
      "pattern": "^[0-9a-f]{8}-[0-9a-f]{4}-7[0-9a-f]{3}-[89ab][0-9a-f]{3}-[0-9a-f]{12}$"
    },
    "from": {
      "type": "string",
      "description": "Sender identityId"
    },
    "to": {
      "oneOf": [
        { "type": "string", "description": "Single target identityId" },
        {
          "type": "object",
          "required": ["collectiveId"],
          "properties": {
            "collectiveId": { "type": "string" },
            "routingHint": {
              "type": "string",
              "enum": ["fan-out", "specialist", "central"]
            }
          },
          "additionalProperties": false
        }
      ]
    },
    "inReplyTo": {
      "type": "string",
      "description": "Optional parent messageId"
    },
    "threadId": {
      "type": "string",
      "description": "Optional conversation / coupling thread"
    },
    "createdAt": {
      "type": "string",
      "format": "date-time"
    },
    "signal": {
      "type": "object",
      "required": ["type"],
      "properties": {
        "type": {
          "type": "string",
          "enum": [
            "signal-only",
            "message",
            "task",
            "receipt",
            "consent-request",
            "consent-grant",
            "consent-deny"
          ]
        },
        "priority": {
          "type": "string",
          "enum": ["low", "normal", "high"],
          "default": "normal"
        },
        "frequency": {
          "type": "string",
          "description": "Declared frequency class of this message"
        }
      },
      "additionalProperties": false
    },
    "payload": {
      "$ref": "#/$defs/Payload"
    },
    "ownership": {
      "type": "object",
      "properties": {
        "holder": {
          "type": "string",
          "description": "identityId that currently holds primary ownership of the Payload"
        },
        "visibility": {
          "type": "string",
          "enum": ["sender-receiver", "thread", "collective", "public"],
          "default": "sender-receiver"
        }
      },
      "additionalProperties": false
    },
    "impactHints": {
      "type": "array",
      "items": {
        "type": "string",
        "enum": ["informational", "mass-altering", "stem-altering"]
      },
      "description": "Sender-declared impact class; service uses for consent gating"
    },
    "signature": {
      "type": "object",
      "properties": {
        "alg": { "type": "string" },
        "keyId": { "type": "string" },
        "value": { "type": "string" }
      },
      "additionalProperties": false
    }
  },
  "$defs": {
    "Payload": {
      "type": "object",
      "required": ["contentType"],
      "properties": {
        "contentType": {
          "type": "string",
          "enum": [
            "text/plain",
            "text/markdown",
            "application/json",
            "application/a2a-task+json",
            "application/octet-stream"
          ]
        },
        "inline": {
          "type": "string",
          "description": "Base64 or plain text when small"
        },
        "reference": {
          "type": "object",
          "required": ["uri"],
          "properties": {
            "uri": { "type": "string", "format": "uri" },
            "hash": {
              "type": "string",
              "description": "sha256:... integrity check"
            },
            "sizeBytes": { "type": "integer", "minimum": 0 }
          },
          "additionalProperties": false
        }
      },
      "oneOf": [
        { "required": ["inline"] },
        { "required": ["reference"] }
      ],
      "additionalProperties": false
    }
  },
  "additionalProperties": false
}