{
  "messageId": "018f3a2b-7c9e-7d01-8a2b-0000000000b2",
  "from": "018f3a2b-7c9e-7d01-8a2b-0000000000a3",
  "to": "018f3a2b-7c9e-7d01-8a2b-0000000000a1",
  "createdAt": "2026-08-30T05:59:00Z",
  "signal": {
    "type": "task",
    "priority": "normal",
    "frequency": "async"
  },
  "payload": {
    "contentType": "text/plain",
    "inline": "This sender is not on the receiver allowlist."
  },
  "impactHints": ["informational"]
}